Scholar Name,Title,Publication Link,Authors,Journal/Conference,DOI,Citation Count,Scholar Profile,Page
Kyungdo Han,Association of Waist Circumference with the Risk of Inflammatory Bowel Disease: a Nationwide Cohort Study of 10 Million Individuals in Korea,http://dx.doi.org/10.1093/ecco-jcc/jjac193,"Je, Yeonjin | Han, Kyungdo | Chun, Jaeyoung | Kim, Yuna | Kim, Jie-Hyun | Hoon Youn, Young | Park, Hyojin | Pil Im, Jong | Sung Kim, Joo","Journal of Crohn's and Colitis, volume 17, issue 5, pages 681-692 (2023).",http://dx.doi.org/10.1093/ecco-jcc/jjac193,3,https://scholargps.com/scholars/74105335250496/kyungdo-han,12
Kyungdo Han,Tuberculosis and the Risk of Ischemic Heart Disease: A Nationwide Cohort Study,http://dx.doi.org/10.1093/cid/ciac946,"Lee, Han Rim | Yoo, Jung Eun | Choi, Hayoung | Han, Kyungdo | Lim, Young-Hyo | Lee, Hyun | Shin, Dong Wook","Clinical Infectious Diseases, volume 76, issue 9, pages 1576-1584 (2023).",http://dx.doi.org/10.1093/cid/ciac946,9,https://scholargps.com/scholars/74105335250496/kyungdo-han,12
Kyungdo Han,Association between exercise and risk of fractures in new-onset type 2 diabetes: a retrospective cohort study,http://dx.doi.org/10.1007/s11657-023-01240-y,"Lee, Seung Eun | Yoo, Juhwan | Kim, Bong-Seong | Kim, Kyoung-Ah | Han, Kyungdo | Choi, Han Seok","Archives of Osteoporosis, volume 18, issue 1 (2023).",http://dx.doi.org/10.1007/s11657-023-01240-y,0,https://scholargps.com/scholars/74105335250496/kyungdo-han,12
Kyungdo Han,Age‐Related Macular Degeneration With Visual Disability Is Associated With Cardiovascular Disease Risk in the Korean Nationwide Cohort,http://dx.doi.org/10.1161/JAHA.122.028027,"Jung, Wonyoung | Han, Kyungdo | Kim, Bongseong | Hwang, Sungsoon | Yoon, Je Moon | Park, Junhee | Lim, Dong Hui | Shin, Dong Wook","Journal of the American Heart Association, volume 12, issue 9 (2023).",http://dx.doi.org/10.1161/JAHA.122.028027,3,https://scholargps.com/scholars/74105335250496/kyungdo-han,12
Kyungdo Han,Incidence of dysphagia requiring medical attention in various types of cancers: A nationwide population-based cohort study,http://dx.doi.org/10.1007/s00520-023-07778-4,"Kwon, SuYeon | Kim, Gowun | Cha, Seungwoo | Han, Kyungdo | Paik, Nam-Jong | Kim, Won-Seok","Supportive Care in Cancer, volume 31, issue 5 (2023).",http://dx.doi.org/10.1007/s00520-023-07778-4,0,https://scholargps.com/scholars/74105335250496/kyungdo-han,12
Kyungdo Han,Association of Body Mass Index and Fracture Risk Varied by Affected Bones in Patients with Diabetes: A Nationwide Cohort Study (Diabetes Metab J 2023;47:242-54),http://dx.doi.org/10.4093/dmj.2023.0104,"Lee, Se-Won | Han, Kyungdo | Kwon, Hyuk-Sang","Diabetes & Metabolism Journal, volume 47, issue 3, pages 439-440 (2023).",http://dx.doi.org/10.4093/dmj.2023.0104,0,https://scholargps.com/scholars/74105335250496/kyungdo-han,12
Kyungdo Han,Association of Metabolic Syndrome Components and Nutritional Status with Kidney Cancer in Young Adult Population: A Nationwide Population-Based Cohort Study in Korea,http://dx.doi.org/10.3390/biomedicines11051425,"Lee, Hee Yeon | Han, Kyung-Do | Woo, In Sook | Kwon, Hyuk-Sang","Biomedicines, volume 11, issue 5, pages 1425- (2023).",http://dx.doi.org/10.3390/biomedicines11051425,1,https://scholargps.com/scholars/74105335250496/kyungdo-han,12
Kyungdo Han,"Altered Risk of Incident Gout According to Changes in Metabolic Syndrome Status: A Nationwide, Population‐Based Cohort Study of 1.29 Million Young Men",http://dx.doi.org/10.1002/art.42381,"Eun, Yeonghee | Han, Kyungdo | Lee, Seung Woo | Kim, Kyunga | Kang, Seonyoung | Lee, Seulkee | Cha, Hoon‐Suk | Koh, Eun‐Mi | Kim, Hyungjin | Lee, Jaejoon","Arthritis & Rheumatology, volume 75, issue 5, pages 806-815 (2023).",http://dx.doi.org/10.1002/art.42381,5,https://scholargps.com/scholars/74105335250496/kyungdo-han,12
Kyungdo Han,Fatty Liver & Diabetes Statistics in Korea: Nationwide Data 2009 to 2017,http://dx.doi.org/10.4093/dmj.2022.0444,"Han, Eugene | Han, Kyung-Do | Lee, Yong-ho | Kim, Kyung-Soo | Hong, Sangmo | Park, Jung Hwan | Park, Cheol-Young","Diabetes & Metabolism Journal, volume 47, issue 3, pages 347-355 (2023).",http://dx.doi.org/10.4093/dmj.2022.0444,12,https://scholargps.com/scholars/74105335250496/kyungdo-han,12
Kyungdo Han,Association between glycemic status and age-related macular degeneration: A nationwide population-based cohort study,http://dx.doi.org/10.1016/j.diabet.2023.101442,"Lee, Hyungwoo | Han, Kyung-Do | Shin, Jinyoung","Diabetes & Metabolism, volume 49, issue 3, pages 101442- (2023).",http://dx.doi.org/10.1016/j.diabet.2023.101442,2,https://scholargps.com/scholars/74105335250496/kyungdo-han,12
Kyungdo Han,Serum 25-hydroxyvitamin D concentrations are inversely associated with all-cause mortality among Koreans: a nationwide cohort study,http://dx.doi.org/10.1016/j.nutres.2023.02.008,"Park, Kye-Yeung | Han, Kyungdo | Hwang, Hwan-Sik | Park, Hoon-Ki | Park, Kyongmin","Nutrition Research, volume 113 (2023).",http://dx.doi.org/10.1016/j.nutres.2023.02.008,0,https://scholargps.com/scholars/74105335250496/kyungdo-han,12
Kyungdo Han,Risk of fracture in neuromyelitis optica spectrum disorder and multiple sclerosis: a nationwide cohort study in South Korea,http://dx.doi.org/10.1007/s00198-023-06715-9,"Jung, Se Young | Cho, Eun Bin | Han, Kyung-Do | Jung, Jin Hyung | Yeo, Yohwan | Kong, Sung Hye | Shin, Dong Wook | Min, Ju-Hong","Osteoporosis International, volume 34, issue 5, pages 925-933 (2023).",http://dx.doi.org/10.1007/s00198-023-06715-9,3,https://scholargps.com/scholars/74105335250496/kyungdo-han,12
Kyungdo Han,Cumulative exposure to metabolic syndrome in a national population-based cohort of young adults and sex-specific risk for type 2 diabetes,http://dx.doi.org/10.1186/s13098-023-01030-z,"Lee, Min-Kyung | Lee, Jae-Hyuk | Sohn, Seo Young | Ahn, Jiyeon | Hong, Oak-Kee | Kim, Mee-Kyoung | Baek, Ki-Hyun | Song, Ki-Ho | Han, Kyungdo | Kwon, Hyuk-Sang","Diabetology & Metabolic Syndrome, volume 15, issue 1 (2023).",http://dx.doi.org/10.1186/s13098-023-01030-z,3,https://scholargps.com/scholars/74105335250496/kyungdo-han,12
Kyungdo Han,Risk of cancer in patients with insomnia: Nationwide retrospective cohort study (2009–2018),http://dx.doi.org/10.1371/journal.pone.0284494,"Yoon, Kichul | Shin, Cheol Min | Han, Kyungdo | Jung, Jin Hyung | Jin, Eun Hyo | Lim, Joo Hyun | Kang, Seung Joo | Choi, Yoon Jin | Lee, Dong Ho","PLOS ONE, volume 18, issue 4, pages e0284494- (2023).",http://dx.doi.org/10.1371/journal.pone.0284494,4,https://scholargps.com/scholars/74105335250496/kyungdo-han,12
Kyungdo Han,Impact of coronary artery revascularization on long-term outcome in hypertrophic cardiomyopathy patients: a nationwide population-based cohort study,http://dx.doi.org/10.1038/s41598-023-33344-3,"Rhee, Tae-Min | Kim, Hyung-Kwan | Kim, Bong-Seong | Han, Kyung-Do | Lee, Hyun-Jung | Hwang, In-Chang | Lee, Heesun | Park, Jun-Bean | Yoon, Yeonyee E. | Kim, Yong-Jin | Cho, Goo-Yeong","Scientific Reports, volume 13, issue 1 (2023).",http://dx.doi.org/10.1038/s41598-023-33344-3,1,https://scholargps.com/scholars/74105335250496/kyungdo-han,12
Kyungdo Han,Association of immune-mediated inflammatory diseases with depression and anxiety in patients with type 2 diabetes: A nationwide population-based study,http://dx.doi.org/10.3389/fmed.2023.1103911,"Kwon, Oh Chan | Kim, Yuna | Chun, Jaeyoung | Han, Kyungdo | Park, Min-Chan | Kim, Ryul | Kim, Jie-Hyun | Youn, Young Hoon | Park, Hyojin","Frontiers in Medicine, volume 10 (2023).",http://dx.doi.org/10.3389/fmed.2023.1103911,2,https://scholargps.com/scholars/74105335250496/kyungdo-han,12
Kyungdo Han,Diabetes severity is strongly associated with the risk of active tuberculosis in people with type 2 diabetes: a nationwide cohort study with a 6-year follow-up,http://dx.doi.org/10.1186/s12931-023-02414-5,"Kang, Ji Young | Han, Kyungdo | Lee, Seung-Hwan | Kim, Mee Kyoung","Respiratory Research, volume 24, issue 1 (2023).",http://dx.doi.org/10.1186/s12931-023-02414-5,3,https://scholargps.com/scholars/74105335250496/kyungdo-han,13
Kyungdo Han,Blood pressure status affects atrial fibrillation in diabetic end-stage renal disease,http://dx.doi.org/10.1371/journal.pone.0283875,"Han, Kyung-Do | Hwang, YouMi | Park, Sang Hyun","PLOS ONE, volume 18, issue 4, pages e0283875- (2023).",http://dx.doi.org/10.1371/journal.pone.0283875,0,https://scholargps.com/scholars/74105335250496/kyungdo-han,13
Kyungdo Han,A population-based cohort study on risk factors for acute pancreatitis: A comparison by age group,http://dx.doi.org/10.1016/j.pan.2023.03.004,"Park, Jin Myung | Park, Namyoung | Lee, Sang Hyub | Han, Kyung Do | Kang, Chang Don | Lee, Jae Min | Paik, Woo Hyun | Ryu, Ji Kon | Kim, Yong-Tae","Pancreatology, volume 23, issue 3, pages 321-329 (2023).",http://dx.doi.org/10.1016/j.pan.2023.03.004,0,https://scholargps.com/scholars/74105335250496/kyungdo-han,13
Kyungdo Han,Glucose Control in Korean Patients with Type 2 Diabetes Mellitus according to Body Mass Index,http://dx.doi.org/10.7570/jomes22047,"Shin, Ye-lim | Yoo, Heesoh | Hong, Joo Young | Kim, Jooeun | Han, Kyung-do | Lee, Kyu-Na | Kim, Yang-Hyun","Journal of Obesity & Metabolic Syndrome, volume 32, issue 1, pages 55-63 (2023).",http://dx.doi.org/10.7570/jomes22047,0,https://scholargps.com/scholars/74105335250496/kyungdo-han,13
Kyungdo Han,Presence and severity of migraine is associated with development of primary open angle glaucoma: A population-based longitudinal cohort study,http://dx.doi.org/10.1371/journal.pone.0283495,"Ohn, Kyoung | Han, Kyungdo | Moon, Jung Il | Jung, Younhea","PLOS ONE, volume 18, issue 3, pages e0283495- (2023).",http://dx.doi.org/10.1371/journal.pone.0283495,2,https://scholargps.com/scholars/74105335250496/kyungdo-han,13
Kyungdo Han,Blood pressure and dementia risk by physical frailty in the elderly: a nationwide cohort study,http://dx.doi.org/10.1186/s13195-023-01211-y,"Cho, Mi Hee | Han, Kyungdo | Lee, Seungwoo | Jeong, Su-Min | Yoo, Jung Eun | Kim, SangYun | Lee, Jinkook | Chun, Sohyun | Shin, Dong Wook","Alzheimer's Research & Therapy, volume 15, issue 1 (2023).",http://dx.doi.org/10.1186/s13195-023-01211-y,1,https://scholargps.com/scholars/74105335250496/kyungdo-han,13
Kyungdo Han,Impact of abdominal obesity on the risk of glioma development in patients with diabetes: A nationwide population-based cohort study in Korea,http://dx.doi.org/10.1371/journal.pone.0283023,"Sang, Hyunji | Cho, Yun Kyung | Han, Kyungdo | Koh, Eun Hee","PLOS ONE, volume 18, issue 3, pages e0283023- (2023).",http://dx.doi.org/10.1371/journal.pone.0283023,0,https://scholargps.com/scholars/74105335250496/kyungdo-han,13
Kyungdo Han,Association between exercise habit changes and incident dementia after ischemic stroke,http://dx.doi.org/10.1038/s41598-023-31229-z,"Cheon, Dae Young | Han, Kyung do | Kim, Chi-hun | Oh, Mi Sun | Lee, Byung-Chul | Kim, Yerim | Lee, Sang-Hwa | Kim, Chulho | Lim, Jae-Sung | Lee, Minwoo | Yu, Kyung-Ho","Scientific Reports, volume 13, issue 1 (2023).",http://dx.doi.org/10.1038/s41598-023-31229-z,0,https://scholargps.com/scholars/74105335250496/kyungdo-han,13
Kyungdo Han,"Association of general and central obesity, and their changes with risk of knee osteoarthritis: a nationwide population-based cohort study",http://dx.doi.org/10.1038/s41598-023-30727-4,"Park, Dojoon | Park, Yong-Moon | Ko, Seung-Hyun | Hyun, Kang-Se | Choi, Youn-Ho | Min, Dong-Uk | Han, Kyungdo | Koh, Hae-Seok","Scientific Reports, volume 13, issue 1 (2023).",http://dx.doi.org/10.1038/s41598-023-30727-4,15,https://scholargps.com/scholars/74105335250496/kyungdo-han,13
Kyungdo Han,Obesity Is Indirectly Associated with Sudden Cardiac Arrest through Various Risk Factors,http://dx.doi.org/10.3390/jcm12052068,"Kim, Yun Gi | Jeong, Joo Hee | Roh, Seung-Young | Han, Kyung-Do | Choi, Yun Young | Min, Kyongjin | Shim, Jaemin | Choi, Jong-Il | Kim, Young-Hoon","Journal of Clinical Medicine, volume 12, issue 5, pages 2068- (2023).",http://dx.doi.org/10.3390/jcm12052068,3,https://scholargps.com/scholars/74105335250496/kyungdo-han,13
Kyungdo Han,Smoking Cessation Reduces the Risk of Heart Failure,http://dx.doi.org/10.1016/j.jchf.2022.07.006,"Yoo, Jung Eun | Jeong, Su-Min | Yeo, Yohwan | Jung, Wonyoung | Yoo, Juhwan | Han, Kyungdo | Lee, Cheol Min | Park, Jin Ho | Park, Kyung Woo | Shin, Dong Wook","JACC: Heart Failure, volume 11, issue 3, pages 277-287 (2023).",http://dx.doi.org/10.1016/j.jchf.2022.07.006,3,https://scholargps.com/scholars/74105335250496/kyungdo-han,13
Kyungdo Han,Comparison of Operational Definition of Type 2 Diabetes Mellitus Based on Data from Korean National Health Insurance Service and Korea National Health and Nutrition Examination Survey,http://dx.doi.org/10.4093/dmj.2022.0375,"Baek, Jong Ha | Park, Yong-Moon | Han, Kyung Do | Moon, Min Kyong | Choi, Jong Han | Ko, Seung-Hyun","Diabetes & Metabolism Journal, volume 47, issue 2, pages 201-210 (2023).",http://dx.doi.org/10.4093/dmj.2022.0375,6,https://scholargps.com/scholars/74105335250496/kyungdo-han,13
Kyungdo Han,Insulin Fact Sheet in Type 1 and 2 Diabetes Mellitus and Trends of Antidiabetic Medication Use in Insulin Users with Type 2 Diabetes Mellitus: 2002 to 2019,http://dx.doi.org/10.4093/dmj.2022.0346,"Park, Jiyun | Kim, Gyuri | Kim, Bong-Sung | Han, Kyung-Do | Kwon, So Yoon | Park, So Hee | Lee, You-Bin | Jin, Sang-Man | Kim, Jae Hyeon","Diabetes & Metabolism Journal, volume 47, issue 2, pages 211-219 (2023).",http://dx.doi.org/10.4093/dmj.2022.0346,5,https://scholargps.com/scholars/74105335250496/kyungdo-han,13
Kyungdo Han,Bladder Cancer in South Korea: Analysis of Trends and Risk Factors of Bladder Cancer in South Korea Using a Nationwide Database,http://dx.doi.org/10.22465/juo.234600040002,"Yoo, Sangjun | Han, Kyung-Do | Kim, Kwang Taek | Choi, Woo Suk | Ha, Yun-Sok | Kim, Jeong Hyun | Kwak, Cheol","The Korean Journal of Urological Oncology, volume 21, issue 1, pages 45-52 (2023).",http://dx.doi.org/10.22465/juo.234600040002,2,https://scholargps.com/scholars/74105335250496/kyungdo-han,13
Kyungdo Han,Depression and anxiety are associated with poor outcomes in patients with inflammatory bowel disease: A nationwide population-based cohort study in South Korea,http://dx.doi.org/10.1016/j.genhosppsych.2023.01.015,"Kim, Seulji | Lee, Seungwoo | Han, Kyungdo | Koh, Seong-Joon | Im, Jong Pil | Kim, Joo Sung | Lee, Hyun Jung","General Hospital Psychiatry, volume 81 (2023).",http://dx.doi.org/10.1016/j.genhosppsych.2023.01.015,4,https://scholargps.com/scholars/74105335250496/kyungdo-han,13
Kyungdo Han,The effects of socioeconomic status on major adverse cardiovascular events: a nationwide population-based cohort study,http://dx.doi.org/10.23876/j.krcp.21.249,"Bae, Eun Hui | Lim, Sang Yup | Yang, Eun Mi | Oh, Tae Ryom | Choi, Hong Sang | Kim, Chang Seong | Ma, Seong Kwon | Kim, Bongseong | Han, Kyung-Do | Kim, Soo Wan","Kidney Research and Clinical Practice, volume 42, issue 2, pages 229-242 (2023).",http://dx.doi.org/10.23876/j.krcp.21.249,0,https://scholargps.com/scholars/74105335250496/kyungdo-han,13
Kyungdo Han,Association of Body Mass Index and Fracture Risk Varied by Affected Bones in Patients with Diabetes: A Nationwide Cohort Study,http://dx.doi.org/10.4093/dmj.2022.0001,"Lee, Se-Won | Han, Kyungdo | Kwon, Hyuk-Sang","Diabetes & Metabolism Journal, volume 47, issue 2, pages 242-254 (2023).",http://dx.doi.org/10.4093/dmj.2022.0001,4,https://scholargps.com/scholars/74105335250496/kyungdo-han,13
Kyungdo Han,The effect of metabolic dysfunction-associated fatty liver disease and diabetic kidney disease on the risk of hospitalization of heart failure in type 2 diabetes: a retrospective cohort study,http://dx.doi.org/10.1186/s13098-023-01006-z,"Lee, Seung Eun | Yoo, Juhwan | Kim, Bong-Seong | Choi, Han Seok | Han, Kyungdo | Kim, Kyoung-Ah","Diabetology & Metabolic Syndrome, volume 15, issue 1 (2023).",http://dx.doi.org/10.1186/s13098-023-01006-z,1,https://scholargps.com/scholars/74105335250496/kyungdo-han,13
Kyungdo Han,Does panic disorder increase the risk of cardiovascular diseases in diabetics?: A nationwide population-based study,http://dx.doi.org/10.1016/j.jad.2023.01.066,"Um, Yoo Hyun | Han, Kyung-Do | Kim, Tae-Won | Jeong, Jong-Hyun | Hong, Seung-Chul | Seo, Ho-Jun","Journal of Affective Disorders, volume 325 (2023).",http://dx.doi.org/10.1016/j.jad.2023.01.066,0,https://scholargps.com/scholars/74105335250496/kyungdo-han,13
Kyungdo Han,"The association between smoking, changes in smoking behavior, and acute pancreatitis: A population‐based cohort study in Korea",http://dx.doi.org/10.1111/jgh.16061,"Lee, Jae Min | Han, Kyung Do | Lee, Sang Hyub | Park, Jin Myung | Park, Namyoung | Jeon, Hankyu | Kim, Hyun Jin | Ryu, Ji Kon | Kim, Yong‐Tae","Journal of Gastroenterology and Hepatology, volume 38, issue 3, pages 451-459 (2023).",http://dx.doi.org/10.1111/jgh.16061,1,https://scholargps.com/scholars/74105335250496/kyungdo-han,13
Kyungdo Han,Renal outcomes of rivaroxaban compared with warfarin in Asian patients with nonvalvular atrial fibrillation: A nationwide population-based cohort study,http://dx.doi.org/10.3389/fcvm.2023.1040834,"Lee, So-Ryoung | Choi, Eue-Keun | Park, Sang-Hyun | Han, Kyung-Do | Oh, Seil | Abdelgawwad, Khaled | Lip, Gregory Y. H.","Frontiers in Cardiovascular Medicine, volume 10 (2023).",http://dx.doi.org/10.3389/fcvm.2023.1040834,1,https://scholargps.com/scholars/74105335250496/kyungdo-han,14
Kyungdo Han,Long-term increase in fasting blood glucose is associated with increased risk of sudden cardiac arrest,http://dx.doi.org/10.1186/s12933-023-01764-0,"Kim, Yun Gi | Roh, Seung-Young | Jeong, Joo Hee | Lee, Hyoung Seok | Min, Kyongjin | Choi, Yun Young | Han, Kyung-Do | Shim, Jaemin | Choi, Jong-Il | Kim, Young-Hoon","Cardiovascular Diabetology, volume 22, issue 1 (2023).",http://dx.doi.org/10.1186/s12933-023-01764-0,2,https://scholargps.com/scholars/74105335250496/kyungdo-han,14
Kyungdo Han,Associations of reproductive factors with incidence of myocardial infarction and ischemic stroke in postmenopausal women: a cohort study,http://dx.doi.org/10.1186/s12916-023-02757-2,"Jeong, Su-Min | Yoo, Jung Eun | Jeon, Keun Hye | Han, Kyungdo | Lee, Heesun | Lee, Dong-Yun | Shin, Dong Wook","BMC Medicine, volume 21, issue 1 (2023).",http://dx.doi.org/10.1186/s12916-023-02757-2,6,https://scholargps.com/scholars/74105335250496/kyungdo-han,14
Kyungdo Han,Association between low-density lipoprotein cholesterol and sudden cardiac arrest in people with diabetes mellitus,http://dx.doi.org/10.1186/s12933-023-01769-9,"Kim, Yun Gi | Jeong, Joo Hee | Han, Kyung-Do | Roh, Seung-Young | Min, Kyongjin | Lee, Hyoung Seok | Choi, Yun Young | Shim, Jaemin | Choi, Jong-Il | Kim, Young-Hoon","Cardiovascular Diabetology, volume 22, issue 1 (2023).",http://dx.doi.org/10.1186/s12933-023-01769-9,8,https://scholargps.com/scholars/74105335250496/kyungdo-han,14
Kyungdo Han,Association between knee osteoarthritis and the risk of cardiovascular disease and the synergistic adverse effects of lack of exercise,http://dx.doi.org/10.1038/s41598-023-29581-1,"Park, Dojoon | Park, Yong-Moon | Ko, Seung-Hyun | Choi, Youn-Ho | Min, Dong-Uk | Ahn, Jae-Hyun | Kim, Bongseong | Koh, Hae-Seok | Han, Kyungdo","Scientific Reports, volume 13, issue 1 (2023).",http://dx.doi.org/10.1038/s41598-023-29581-1,7,https://scholargps.com/scholars/74105335250496/kyungdo-han,14
Kyungdo Han,Association of reproductive factors with cardiovascular disease risk in pre-menopausal women: nationwide population-based cohort study,http://dx.doi.org/10.1093/eurjpc/zwac265,"Jeong, Su-Min | Jeon, Keun Hye | Jung, Wonyoung | Yoo, Jung Eun | Yoo, Juhwan | Han, Kyungdo | Kim, Ju Youn | Lee, Dong-Yun | Lee, You-Bin | Shin, Dong Wook","European Journal of Preventive Cardiology, volume 30, issue 3, pages 264-273 (2023).",http://dx.doi.org/10.1093/eurjpc/zwac265,6,https://scholargps.com/scholars/74105335250496/kyungdo-han,14
Kyungdo Han,Positive Results from the Fecal Immunochemical Test Can Be Related to Dementia: A Nationwide Population-Based Study in South Korea,http://dx.doi.org/10.3233/JAD-220770,"Jun, Yu Kyung | Lee, Seung Woo | Kim, Kwang Woo | Moon, Jung Min | Koh, Seong-Joon | Lee, Hyun Jung | Kim, Joo Sung | Han, Kyungdo | Im, Jong Pil","Journal of Alzheimer's Disease, volume 91, issue 4, pages 1515-1525 (2023).",http://dx.doi.org/10.3233/JAD-220770,1,https://scholargps.com/scholars/74105335250496/kyungdo-han,14
Kyungdo Han,De novo major cardiovascular events in kidney transplant recipients: a comparative matched cohort study,http://dx.doi.org/10.1093/ndt/gfac144,"Kim, Ji Eun | Park, Jina | Park, Sehoon | Yu, Mi-yeon | Baek, Seon Ha | Park, Sang Hyun | Han, Kyungdo | Kim, Yong Chul | Kim, Dong Ki | Oh, Kook-Hwan | ... | Lee, Hajeong","Nephrology Dialysis Transplantation, volume 38, issue 2, pages 499-506 (2023).",http://dx.doi.org/10.1093/ndt/gfac144,1,https://scholargps.com/scholars/74105335250496/kyungdo-han,14
Kyungdo Han,Safety and effectiveness of anticoagulation with non-vitamin K antagonist oral anticoagulants and warfarin in patients on tuberculosis treatment,http://dx.doi.org/10.1038/s41598-023-29185-9,"Lee, Hyun-Jung | Kim, Hyung-Kwan | Kim, Bong-Seong | Han, Kyung-Do | Park, Chan Soon | Rhee, Tae-Min | Park, Jun-Bean | Lee, Heesun | Kim, Yong-Jin","Scientific Reports, volume 13, issue 1 (2023).",http://dx.doi.org/10.1038/s41598-023-29185-9,0,https://scholargps.com/scholars/74105335250496/kyungdo-han,14
Kyungdo Han,"Rheumatoid arthritis and the risk of end-stage renal disease: A nationwide, population-based study",http://dx.doi.org/10.3389/fmed.2023.1116489,"Suh, Sang Heon | Jung, Jin Hyung | Oh, Tae Ryom | Yang, Eun Mi | Choi, Hong Sang | Kim, Chang Seong | Bae, Eun Hui | Ma, Seong Kwon | Han, Kyung-Do | Kim, Soo Wan","Frontiers in Medicine, volume 10 (2023).",http://dx.doi.org/10.3389/fmed.2023.1116489,5,https://scholargps.com/scholars/74105335250496/kyungdo-han,14
Kyungdo Han,"The beneficial effects of an adenotonsillectomy upon upper respiratory tract infections, asthma and rhinitis in children: a national database study in Korea",http://dx.doi.org/10.1080/00016489.2023.2181391,"Bae, Mi Rye | Han, Kyung-Do | Park, Sang-Hyun | Chung, Yoo-Sam","Acta Oto-Laryngologica, volume 143, issue 2, pages 191-195 (2023).",http://dx.doi.org/10.1080/00016489.2023.2181391,0,https://scholargps.com/scholars/74105335250496/kyungdo-han,14
Kyungdo Han,Predicting the Risk of Insulin-Requiring Gestational Diabetes before Pregnancy: A Model Generated from a Nationwide Population-Based Cohort Study in Korea,http://dx.doi.org/10.3803/EnM.2022.1609,"Lee, Seung-Hwan | Yu, Jin | Han, Kyungdo | Lee, Seung Woo | You, Sang Youn | Kim, Hun-Sung | Cho, Jae-Hyoung | Yoon, Kun-Ho | Kim, Mee Kyoung","Endocrinology and Metabolism, volume 38, issue 1, pages 129-138 (2023).",http://dx.doi.org/10.3803/EnM.2022.1609,5,https://scholargps.com/scholars/74105335250496/kyungdo-han,14
Kyungdo Han,Fatty Liver and Risk of Head and Neck Cancer in Type 2 Diabetes Mellitus: A Nationwide Cohort Study,http://dx.doi.org/10.3390/cancers15041209,"Park, Junhee | Han, Kyungdo | Lee, Seung Woo | Jeon, Yeong Jeong | Jin, Sang-Man | Jung, Wonyoung | So, Yoon Kyoung | Hong, Sang Duk | Shin, Dong Wook","Cancers, volume 15, issue 4, pages 1209- (2023).",http://dx.doi.org/10.3390/cancers15041209,0,https://scholargps.com/scholars/74105335250496/kyungdo-han,14
Kyungdo Han,Changes in Alcohol Consumption and Risk of Dementia in a Nationwide Cohort in South Korea,http://dx.doi.org/10.1001/jamanetworkopen.2022.54771,"Jeon, Keun Hye | Han, Kyungdo | Jeong, Su-Min | Park, Junhee | Yoo, Jung Eun | Yoo, Juhwan | Lee, Jinkook | Kim, SangYun | Shin, Dong Wook","JAMA Network Open, volume 6, issue 2, pages e2254771- (2023).",http://dx.doi.org/10.1001/jamanetworkopen.2022.54771,25,https://scholargps.com/scholars/74105335250496/kyungdo-han,14
Kyungdo Han,Lower risk of depression after smoking cessation and alcohol abstinence in patients with gastric cancer who underwent gastrectomy: A population-based nationwide cohort study.,http://dx.doi.org/10.1200/JCO.2023.41.4_suppl.314,"Kim, Bokyung | Han, Kyungdo | Chung, Hyunsoo | Kim, Sang Gyun | Cho, Soo-Jeong","Journal of Clinical Oncology, volume 41, issue 4_suppl, pages 314-314 (2023).",http://dx.doi.org/10.1200/JCO.2023.41.4_suppl.314,1,https://scholargps.com/scholars/74105335250496/kyungdo-han,14
Kyungdo Han,"Body mass index, waist circumference and cardiovascular diseases in transitional ages (40 and 66 years)",http://dx.doi.org/10.1002/jcsm.13138,"Yoo, Jung Eun | Han, Kyungdo | Jung, Jin‐Hyung | Hur, Yang‐Im | Kim, Yang Hyun | Kim, Eun Sook | Son, Jang Won | Rhee, Eun‐Jung | Lee, Won‐Young | Nam, Ga Eun","Journal of Cachexia, Sarcopenia and Muscle, volume 14, issue 1, pages 369-381 (2023).",http://dx.doi.org/10.1002/jcsm.13138,12,https://scholargps.com/scholars/74105335250496/kyungdo-han,14
Kyungdo Han,Threshold dose–response association between smoking pack-years and the risk of gallbladder cancer: A nationwide cohort study,http://dx.doi.org/10.1016/j.ejca.2022.11.031,"Park, Joo-Hyun | Hong, Jung Yong | Han, Kyungdo","European Journal of Cancer, volume 180 (2023).",http://dx.doi.org/10.1016/j.ejca.2022.11.031,1,https://scholargps.com/scholars/74105335250496/kyungdo-han,14
Kyungdo Han,Remnant Cholesterol Is an Independent Predictor of Type 2 Diabetes: A Nationwide Population-Based Cohort Study,http://dx.doi.org/10.2337/dc22-1550,"Huh, Ji Hye | Roh, Eun | Lee, Seong Jin | Ihm, Sung-Hee | Han, Kyung-Do | Kang, Jun Goo","Diabetes Care, volume 46, issue 2, pages 305-312 (2023).",http://dx.doi.org/10.2337/dc22-1550,23,https://scholargps.com/scholars/74105335250496/kyungdo-han,14
