Scholar Name,Title,Publication Link,Authors,Journal/Conference,DOI,Citation Count,Scholar Profile,Page
Kyungdo Han,Association of atopic dermatitis with new‐onset migraine: A nationwide population‐based cohort study,http://dx.doi.org/10.1111/jdv.18680,"Lee, Ji Hae | Kim, Soo Hyung | Lee, Gyu‐na | Han, Kyungdo | Lee, Ji Hyun","Journal of the European Academy of Dermatology and Venereology, volume 37, issue 2 (2023).",http://dx.doi.org/10.1111/jdv.18680,2,https://scholargps.com/scholars/74105335250496/kyungdo-han,14
Kyungdo Han,Allergic Diseases and Risk of Incident Dementia and Alzheimer's Disease,http://dx.doi.org/10.1002/ana.26506,"Joh, Hee‐Kyung | Kwon, Hyuktae | Son, Ki Young | Yun, Jae Moon | Cho, Su Hwan | Han, Kyungdo | Park, Jin‐Ho | Cho, Belong","Annals of Neurology, volume 93, issue 2, pages 384-397 (2023).",http://dx.doi.org/10.1002/ana.26506,11,https://scholargps.com/scholars/74105335250496/kyungdo-han,14
Kyungdo Han,Lower risk of depression after smoking cessation and alcohol abstinence in patients with gastric cancer who underwent gastrectomy: A population-based nationwide cohort study.,http://dx.doi.org/10.1200/JCO.2023.41.4_suppl.314,"Kim, Bokyung | Han, Kyungdo | Chung, Hyunsoo | Kim, Sang Gyun | Cho, Soo-Jeong","Journal of Clinical Oncology, volume 41, issue 4_suppl, pages 314-314 (2023).",http://dx.doi.org/10.1200/JCO.2023.41.4_suppl.314,1,https://scholargps.com/scholars/74105335250496/kyungdo-han,15
Kyungdo Han,Cumulative Alcohol Consumption Burden and the Risk of Stroke in Young Adults,http://dx.doi.org/10.1212/WNL.0000000000201473,"Chung, Jae-wook | Lee, So-Ryoung | Choi, Eue-Keun | Park, Sang-Hyeon | Lee, HuiJin | Choi, JungMin | Han, Minju | Ahn, Hyo-Jeong | Kwon, Soonil | Lee, SeungWoo | ... | Lip, Gregory Y. H.","Neurology, volume 100, issue 5 (2023).",http://dx.doi.org/10.1212/WNL.0000000000201473,5,https://scholargps.com/scholars/74105335250496/kyungdo-han,15
Kyungdo Han,Gamma-glutamyl transferase and risk of all-cause and disease-specific mortality: a nationwide cohort study,http://dx.doi.org/10.1038/s41598-022-25970-0,"Cho, Eun Ju | Jeong, Su-Min | Chung, Goh Eun | Yoo, Jeong-Ju | Cho, Yuri | Lee, Kyu-na | Shin, Dong Wook | Kim, Yoon Jun | Yoon, Jung-Hwan | Han, Kyungdo | Yu, Su Jong","Scientific Reports, volume 13, issue 1 (2023).",http://dx.doi.org/10.1038/s41598-022-25970-0,8,https://scholargps.com/scholars/74105335250496/kyungdo-han,15
Kyungdo Han,P341 Fracture risk in middle-age and older patients with inflammatory bowel disease: A Korean nationwide population-based cohort study,http://dx.doi.org/10.1093/ecco-jcc/jjac190.0471,"Lee, J | Lee, K M | Han, K D","Journal of Crohn's and Colitis, volume 17, issue Supplement_1, pages i478-i478 (2023).",http://dx.doi.org/10.1093/ecco-jcc/jjac190.0471,0,https://scholargps.com/scholars/74105335250496/kyungdo-han,15
Kyungdo Han,Improved prognosis with integrated care management including early rhythm control and healthy lifestyle modification in patients with concurrent atrial fibrillation and diabetes mellitus: a nationwide cohort study,http://dx.doi.org/10.1186/s12933-023-01749-z,"Lee, So-Ryoung | Ahn, Hyo-Jeong | Choi, Eue-Keun | Lee, Seung-Woo | Han, Kyung-Do | Oh, Seil | Lip, Gregory Y. H.","Cardiovascular Diabetology, volume 22, issue 1 (2023).",http://dx.doi.org/10.1186/s12933-023-01749-z,5,https://scholargps.com/scholars/74105335250496/kyungdo-han,15
Kyungdo Han,Being Underweight Is Associated with Increased Risk of Sudden Cardiac Death in People with Diabetes Mellitus,http://dx.doi.org/10.3390/jcm12031045,"Kim, Yun Gi | Han, Kyung-Do | Roh, Seung-Young | Jeong, Joo Hee | Choi, Yun Young | Min, Kyongjin | Shim, Jaemin | Choi, Jong-Il | Kim, Young-Hoon","Journal of Clinical Medicine, volume 12, issue 3, pages 1045- (2023).",http://dx.doi.org/10.3390/jcm12031045,4,https://scholargps.com/scholars/74105335250496/kyungdo-han,15
Kyungdo Han,A nationwide cohort study on diabetes severity and risk of Parkinson disease,http://dx.doi.org/10.1038/s41531-023-00462-8,"Han, Kyungdo | Kim, Bongsung | Lee, Seung Hwan | Kim, Mee Kyoung","npj Parkinson's Disease, volume 9, issue 1 (2023).",http://dx.doi.org/10.1038/s41531-023-00462-8,15,https://scholargps.com/scholars/74105335250496/kyungdo-han,15
Kyungdo Han,Accumulated hypertension burden on atrial fibrillation risk in diabetes mellitus: a nationwide population study,http://dx.doi.org/10.1186/s12933-023-01736-4,"Choi, JungMin | Lee, So-Ryoung | Choi, Eue-Keun | Lee, HuiJin | Han, MinJu | Ahn, Hyo-Jeong | Kwon, Soonil | Lee, Seung-Woo | Han, Kyung-Do | Oh, Seil | Lip, Gregory Y. H.","Cardiovascular Diabetology, volume 22, issue 1 (2023).",http://dx.doi.org/10.1186/s12933-023-01736-4,6,https://scholargps.com/scholars/74105335250496/kyungdo-han,15
Kyungdo Han,Risk of incident mental disorders in hypertrophic cardiomyopathy: a nationwide propensity-matched study,http://dx.doi.org/10.1093/eurjpc/zwac260,"Park, Jun-Bean | Yun, Je-Yeon | Kim, Bongsung | Rhee, Tae-Min | Lee, Hyun-Jung | Lee, Heesun | Hwang, In-Chang | Yoon, Yeonyee E | Park, Hyo Eun | Lee, Seung-Pyo | ... | Kim, Hyung-Kwan","European Journal of Preventive Cardiology, volume 30, issue 1, pages 85-94 (2023).",http://dx.doi.org/10.1093/eurjpc/zwac260,5,https://scholargps.com/scholars/74105335250496/kyungdo-han,15
Kyungdo Han,Impact of albuminuria on the various causes of death in diabetic patients: a nationwide population-based study,http://dx.doi.org/10.1038/s41598-022-23352-0,"Cho, Semin | Huh, Hyuk | Park, Sehoon | Lee, Soojin | Jung, Sehyun | Kim, Minsang | Lee, Kyu-na | Paek, Jin Hyuk | Park, Woo Yeong | Jin, Kyubok | ... | Kim, Dong Ki","Scientific Reports, volume 13, issue 1 (2023).",http://dx.doi.org/10.1038/s41598-022-23352-0,2,https://scholargps.com/scholars/74105335250496/kyungdo-han,15
Kyungdo Han,Increased end-stage renal disease risk in age-related macular degeneration: a nationwide cohort study with 10-year follow-up,http://dx.doi.org/10.1038/s41598-022-26964-8,"Jung, Wonyoung | Park, Junhee | Jang, Hye Ryoun | Jeon, Junseok | Han, Kyungdo | Kim, Bongseong | Yoon, Je Moon | Lim, Dong Hui | Shin, Dong Wook","Scientific Reports, volume 13, issue 1 (2023).",http://dx.doi.org/10.1038/s41598-022-26964-8,2,https://scholargps.com/scholars/74105335250496/kyungdo-han,15
Kyungdo Han,Psychological Stress in Parents of Children with Atopic Dermatitis: A Cross-sectional Study from the Korea National Health and Nutrition Examination Survey,http://dx.doi.org/10.2340/actadv.v103.2242,"Lee, Hyun Ji | Lee, Gyu-Na | Lee, Ji Hyun | Han, Ju Hee | Han, Kyungdo | Park, Young Min","Acta Dermato-Venereologica, volume 103 (2023).",http://dx.doi.org/10.2340/actadv.v103.2242,5,https://scholargps.com/scholars/74105335250496/kyungdo-han,15
Kyungdo Han,Increased Risk of Dementia in Patients with Atopic Dermatitis: A Nationwide Population-Based Cohort Study,http://dx.doi.org/10.2340/actadv.v103.4557,"Woo, Yu Ri | Cho, Minah | Han, Kyung Do | Cho, Sang Hyun | Lee, Ji Hyun","Acta Dermato-Venereologica, volume 103 (2023).",http://dx.doi.org/10.2340/actadv.v103.4557,5,https://scholargps.com/scholars/74105335250496/kyungdo-han,15
Kyungdo Han,Lean or diabetic subtypes predict increased all-cause and disease-specific mortality in metabolic-associated fatty liver disease,http://dx.doi.org/10.1186/s12916-022-02716-3,"Chung, Goh Eun | Yu, Su Jong | Yoo, Jeong-Ju | Cho, Yuri | Lee, Kyu-na | Shin, Dong Wook | Kim, Donghee | Kim, Yoon Jun | Yoon, Jung-Hwan | Han, Kyungdo | Cho, Eun Ju","BMC Medicine, volume 21, issue 1 (2023).",http://dx.doi.org/10.1186/s12916-022-02716-3,12,https://scholargps.com/scholars/74105335250496/kyungdo-han,15
Kyungdo Han,Association of Changes in Smoking Intensity With Risk of Dementia in Korea,http://dx.doi.org/10.1001/jamanetworkopen.2022.51506,"Jeong, Su-Min | Park, Junhee | Han, Kyungdo | Yoo, Juhwan | Yoo, Jung Eun | Lee, Cheol Min | Jung, Wonyoung | Lee, Jinkook | Kim, SangYun | Shin, Dong Wook","JAMA Network Open, volume 6, issue 1, pages e2251506- (2023).",http://dx.doi.org/10.1001/jamanetworkopen.2022.51506,13,https://scholargps.com/scholars/74105335250496/kyungdo-han,15
Kyungdo Han,Association Between Glycemic Status and the Risk of Kidney Cancer in Men and Women: A Nationwide Cohort Study,http://dx.doi.org/10.2337/dc22-0961,"Park, Joo-Hyun | Hong, Jung Yong | Han, Kyungdo | Shen, Jay J.","Diabetes Care, volume 46, issue 1, pages 38-45 (2023).",http://dx.doi.org/10.2337/dc22-0961,2,https://scholargps.com/scholars/74105335250496/kyungdo-han,15
Kyungdo Han,Cholecystectomy Increases the Risk of Type 2 Diabetes in the Korean Population,http://dx.doi.org/10.1097/SLA.0000000000005683,"Huh, Ji Hye | Lee, Kyong Joo | Cho, Yun Kyung | Moon, Shinje | Kim, Yoon Jung | Roh, Eun | Han, Kyung-do | Koh, Dong Hee | Kang, Jun Goo | Lee, Seong Jin | Ihm, Sung-Hee","Annals of Surgery, volume 278, issue 2, pages e264-e271 (2023).",http://dx.doi.org/10.1097/SLA.0000000000005683,3,https://scholargps.com/scholars/74105335250496/kyungdo-han,15
Kyungdo Han,The Association of Smoking Status and Clustering of Obesity and Depression on the Risk of Early–Onset Cardiovascular Disease in Young Adults: A Nationwide Cohort Study,http://dx.doi.org/10.4070/kcj.2022.0179,"Kim, Choon-Young | Lee, Cheol Min | Lee, Seungwoo | Yoo, Jung Eun | Lee, Heesun | Park, Hyo Eun | Han, Kyungdo | Choi, Su-Yeon","Korean Circulation Journal, volume 53, issue 1, pages 17- (2023).",http://dx.doi.org/10.4070/kcj.2022.0179,5,https://scholargps.com/scholars/74105335250496/kyungdo-han,15
Kyungdo Han,"Sustained Low Income, Income Changes, and Risk of All-Cause Mortality in Individuals With Type 2 Diabetes: A Nationwide Population-Based Cohort Study",http://dx.doi.org/10.2337/dc21-2305,"Lee, Hong Seok | Park, Jimin Clara | Chung, Inkwan | Liu, Junxiu | Lee, Seong-Su | Han, Kyungdo","Diabetes Care, volume 46, issue 1, pages 92-100 (2023).",http://dx.doi.org/10.2337/dc21-2305,4,https://scholargps.com/scholars/74105335250496/kyungdo-han,15
Kyungdo Han,Clinical benefits of concomitant surgical ablation for atrial fibrillation in patients undergoing mitral valve surgery,http://dx.doi.org/10.1016/j.hrthm.2022.09.014,"Kim, Hee Jung | Han, Kyung-Do | Kim, Wan Kee | Cho, Yang Hyun | Lee, Seung-Hyun | Je, Hyung Gon","Heart Rhythm, volume 20, issue 1, pages 3-11 (2023).",http://dx.doi.org/10.1016/j.hrthm.2022.09.014,4,https://scholargps.com/scholars/74105335250496/kyungdo-han,15
Kyungdo Han,"Histamine-2 Receptor Antagonists and Proton Pump Inhibitors Are Associated With Reduced Risk of SARS-CoV-2 Infection Without Comorbidities Including Diabetes, Hypertension, and Dyslipidemia: A Propensity Score-Matched Nationwide Cohort Study",http://dx.doi.org/10.3346/jkms.2023.38.e99,"Kim, Bokyung | Jung, Jin-Hyung | Han, Kyungdo | Kang, Seungkyung | Lee, Eunwoo | Chung, Hyunsoo | Kim, Sang Gyun | Cho, Soo-Jeong","Journal of Korean Medical Science, volume 38, issue 13 (2023).",http://dx.doi.org/10.3346/jkms.2023.38.e99,0,https://scholargps.com/scholars/74105335250496/kyungdo-han,16
Kyungdo Han,Association between non-cystic fibrosis bronchiectasis and the risk of incident dementia: A nationwide cohort study,http://dx.doi.org/10.1177/14799731231222282,"Kim, Sang Hyuk | Han, Kyungdo | Park, Jongkyu | Park, Dong Won | Moon, Ji-Yong | Sim, Yun Su | Kim, Tae-Hyung | Kim, Sang-Heon | Sohn, Jang Won | Yoon, Ho Joo | ... | Choi, Hayoung","Chronic Respiratory Disease, volume 20 (2023).",http://dx.doi.org/10.1177/14799731231222282,2,https://scholargps.com/scholars/74105335250496/kyungdo-han,16
Kyungdo Han,Hormone Replacement Therapy and Psoriasis Risk: A Nationwide Population-Based Cohort Study,http://dx.doi.org/10.3346/jkms.2023.38.e377,"Go, Gang Min | Oh, Hyun Ju | Han, Kyungdo | Kim, Yeong Ho | Lee, Hyun Ji | Lee, Ji Hyun","Journal of Korean Medical Science, volume 38, issue 49 (2023).",http://dx.doi.org/10.3346/jkms.2023.38.e377,0,https://scholargps.com/scholars/74105335250496/kyungdo-han,16
Kyungdo Han,Risk of gastric cancer in relation with serum cholesterol profiles: A nationwide population-based cohort study,http://dx.doi.org/10.1097/MD.0000000000036260,"Oh, Mi Jin | Han, Kyungdo | Kim, Bongseong | Lim, Joo Hyun | Kim, Bokyung | Kim, Sang Gyun | Cho, Soo-Jeong","Medicine, volume 102, issue 48, pages e36260- (2023).",http://dx.doi.org/10.1097/MD.0000000000036260,2,https://scholargps.com/scholars/74105335250496/kyungdo-han,16
Kyungdo Han,Risk factors for early-onset lung cancer in Korea: analysis of a nationally representative population-based cohort,http://dx.doi.org/10.4178/epih.e2023101,"Kang, Jihun | Kim, Taeyun | Han, Kyung-Do | Jung, Jin-Hyung | Jeong, Su-Min | Yeo, Yo Hwan | Jung, Kyuwon | Lee, Hyun | Cho, Jong Ho | Shin, Dong Wook","Epidemiology and Health, volume 45 (2023).",http://dx.doi.org/10.4178/epih.e2023101,0,https://scholargps.com/scholars/74105335250496/kyungdo-han,16
Kyungdo Han,Association Between Lipid Profile and Risk of Incident Systemic Sclerosis: A Nationwide Population-Based Study,http://dx.doi.org/10.2147/CLEP.S427881,"Kwon, Oh Chan | Han, Kyungdo | Park, Min-Chan","Clinical Epidemiology, volume Volume 15 (2023).",http://dx.doi.org/10.2147/CLEP.S427881,0,https://scholargps.com/scholars/74105335250496/kyungdo-han,16
Kyungdo Han,Trends in Prevalence of Hypertriglyceridemia and Related Factors in Korean Adults: A Serial Cross-Sectional Study,http://dx.doi.org/10.12997/jla.2023.12.2.201,"Park, Kye-Yeung | Hong, Sangmo | Kim, Kyung-Soo | Han, Kyungdo | Park, Cheol-Young","Journal of Lipid and Atherosclerosis, volume 12, issue 2, pages 201- (2023).",http://dx.doi.org/10.12997/jla.2023.12.2.201,8,https://scholargps.com/scholars/74105335250496/kyungdo-han,16
Kyungdo Han,Higher Non-High-Density Lipoprotein Cholesterol Was Higher Associated With Cardiovascular Disease Comparing Higher LDL-C in Nine Years Follow Up: Cohort Study,http://dx.doi.org/10.12997/jla.2023.12.2.164,"Hong, Sangmo | Han, Kyungdo | Park, Jung Hwan | Yu, Sung Hoon | Lee, Chang Beom | Kim, Dong Sun","Journal of Lipid and Atherosclerosis, volume 12, issue 2, pages 164- (2023).",http://dx.doi.org/10.12997/jla.2023.12.2.164,0,https://scholargps.com/scholars/74105335250496/kyungdo-han,16
Kyungdo Han,Cancer and Mortality Risks of Graves’ Disease in South Korea Based on National Data from 2010 to 2019,http://dx.doi.org/10.2147/CLEP.S406361,"Choi, Young Ju | Han, Kyungdo | Cho, Won Kyoung | Jung, Min Ho | Suh, Byung-Kyu","Clinical Epidemiology, volume Volume 15 (2023).",http://dx.doi.org/10.2147/CLEP.S406361,0,https://scholargps.com/scholars/74105335250496/kyungdo-han,16
Kyungdo Han,Dysphagia Requiring Medical Attention in Parkinson’s Disease: A Korean Population-Based Study,http://dx.doi.org/10.3346/jkms.2023.38.e114,"Cha, Seungwoo | Chang, Won Kee | Cho, Hee-Mun | Han, Kyungdo | Paik, Nam-Jong | Kwon, Sohyun | Kim, Won-Seok","Journal of Korean Medical Science, volume 38, issue 15 (2023).",http://dx.doi.org/10.3346/jkms.2023.38.e114,0,https://scholargps.com/scholars/74105335250496/kyungdo-han,16
Kyungdo Han,Cholecystectomy Increases the Risk of Type 2 Diabetes in the Korean Population,http://dx.doi.org/10.1097/SLA.0000000000005683,"Huh, Ji Hye | Lee, Kyong Joo | Cho, Yun Kyung | Moon, Shinje | Kim, Yoon Jung | Roh, Eun | Han, Kyung-do | Koh, Dong Hee | Kang, Jun Goo | Lee, Seong Jin | Ihm, Sung-Hee","Annals of Surgery, volume 278, issue 2, pages e264-e271 (2023).",http://dx.doi.org/10.1097/SLA.0000000000005683,3,https://scholargps.com/scholars/74105335250496/kyungdo-han,16
Kyungdo Han,Systemic lupus erythematosus is associated with increased risk of Parkinson’s disease,http://dx.doi.org/10.1177/1759720X231152653,"Kim, In Young | Eun, Yeonghee | Lee, Jaejoon | Han, Kyungdo | Kim, Da Hye | Min, Ju-Hong | Cha, Hoon-Suk | Koh, Eun-Mi | Shin, Dong Wook | Kim, Hyungjin","Therapeutic Advances in Musculoskeletal Disease, volume 15 (2023).",http://dx.doi.org/10.1177/1759720X231152653,0,https://scholargps.com/scholars/74105335250496/kyungdo-han,16
Kyungdo Han,Association between Smoking Cessation and the Risk of Cholangiocarcinoma and Ampulla of Vater Cancer: A Nationwide Cohort Study,http://dx.doi.org/10.1159/000529609,"Park, Joo-Hyun | Hong, Jung Yong | Han, Kyungdo","Liver Cancer, volume 12, issue 5, pages 457-466 (2023).",http://dx.doi.org/10.1159/000529609,0,https://scholargps.com/scholars/74105335250496/kyungdo-han,16
Kyungdo Han,Cardiovascular Outcomes according to Comorbidities and Low-Density Lipoprotein Cholesterol in Korean People with Type 2 Diabetes Mellitus,http://dx.doi.org/10.4093/dmj.2021.0344,"Moon, Min Kyong | Noh, Junghyun | Rhee, Eun-Jung | Park, Sang Hyun | Kim, Hyeon Chang | Kim, Byung Jin | Kim, Hae Jin | Choi, Seonghoon | Na, Jin Oh | Hyun, Young Youl | ... | Jeong, In-Kyung","Diabetes & Metabolism Journal, volume 47, issue 1, pages 45-58 (2023).",http://dx.doi.org/10.4093/dmj.2021.0344,8,https://scholargps.com/scholars/74105335250496/kyungdo-han,16
Kyungdo Han,Atopic Disorders and Their Risks of Migraine: A Nationwide Population-Based Cohort Study,http://dx.doi.org/10.4168/aair.2023.15.1.55,"Han, Ju Hee | Lee, Hyun Ji | Yook, Hwa Jung | Han, Kyungdo | Lee, Ji Hyun | Park, Young Min","Allergy, Asthma & Immunology Research, volume 15, issue 1, pages 55- (2023).",http://dx.doi.org/10.4168/aair.2023.15.1.55,6,https://scholargps.com/scholars/74105335250496/kyungdo-han,16
Kyungdo Han,Status of the Newborn Hearing Screening in the 4-Months Age National Infant Health Checkup in Korea: A Nationwide Population-Based Study,http://dx.doi.org/10.3346/jkms.2023.38.e29,"Chang, Jiwon | Park, Su-Kyoung | Im, Gi Jung | Ahn, Joong Ho | Lee, Jun Ho | Han, Kyungdo | Chung, Jong Woo | Kim, Jin-Sook | Jang, Hyunsook | Lee, Seung Hwan","Journal of Korean Medical Science, volume 38, issue 4 (2023).",http://dx.doi.org/10.3346/jkms.2023.38.e29,1,https://scholargps.com/scholars/74105335250496/kyungdo-han,16
Kyungdo Han,Impact of cumulative hyperglycemic burden on the pancreatic cancer risk: A nationwide cohort study,http://dx.doi.org/10.1016/j.diabres.2022.110208,"Koo, Dong-Hoe | Han, Kyungdo | Park, Cheol-Young","Diabetes Research and Clinical Practice, volume 195 (2023).",http://dx.doi.org/10.1016/j.diabres.2022.110208,1,https://scholargps.com/scholars/74105335250496/kyungdo-han,16
Kyungdo Han,Fracture risk in Parkinson’s disease according to its severity and duration,http://dx.doi.org/10.1007/s00198-022-06562-0,"Koo, Hye Yeon | Cho, Eun Bin | Kong, Sung Hye | Han, Kyungdo | Lee, Kyu Na | Yoo, Jung Eun | Min, Ju-Hong | Chun, Sohyun | Shin, Dong Wook","Osteoporosis International, volume 34, issue 1, pages 81-89 (2023).",http://dx.doi.org/10.1007/s00198-022-06562-0,5,https://scholargps.com/scholars/74105335250496/kyungdo-han,16
Kyungdo Han,Risk of various cancers in adults with abdominal aortic aneurysms,http://dx.doi.org/10.1016/j.jvs.2022.03.896,"Cho, Hyung-jin | Yoo, Ju-hwan | Kim, Mi-hyeong | Ko, Kyung-jai | Jun, Kang-woong | Han, Kyung-do | Hwang, Jeong-kye","Journal of Vascular Surgery, volume 77, issue 1, pages 80-88.e2 (2023).",http://dx.doi.org/10.1016/j.jvs.2022.03.896,2,https://scholargps.com/scholars/74105335250496/kyungdo-han,16
Kyungdo Han,Weight change and risk of depression in patients with diabetic kidney disease: a nationwide population-based study,http://dx.doi.org/10.23876/j.krcp.21.294,"Choi, Hong Sang | Kim, Bongseong | Han, Kyung-Do | Oh, Tae Ryom | Suh, Sang Heon | Kim, Minah | Kim, Chang Seong | Bae, Eun Hui | Ma, Seong Kwon | Kim, Soo Wan","Kidney Research and Clinical Practice, volume 42, issue 1, pages 86-97 (2023).",http://dx.doi.org/10.23876/j.krcp.21.294,2,https://scholargps.com/scholars/74105335250496/kyungdo-han,16
Kyungdo Han,Clinical benefits of concomitant surgical ablation for atrial fibrillation in patients undergoing mitral valve surgery,http://dx.doi.org/10.1016/j.hrthm.2022.09.014,"Kim, Hee Jung | Han, Kyung-Do | Kim, Wan Kee | Cho, Yang Hyun | Lee, Seung-Hyun | Je, Hyung Gon","Heart Rhythm, volume 20, issue 1, pages 3-11 (2023).",http://dx.doi.org/10.1016/j.hrthm.2022.09.014,4,https://scholargps.com/scholars/74105335250496/kyungdo-han,17
Kyungdo Han,"Sustained Low Income, Income Changes, and Risk of All-Cause Mortality in Individuals With Type 2 Diabetes: A Nationwide Population-Based Cohort Study",http://dx.doi.org/10.2337/dc21-2305,"Lee, Hong Seok | Park, Jimin Clara | Chung, Inkwan | Liu, Junxiu | Lee, Seong-Su | Han, Kyungdo","Diabetes Care, volume 46, issue 1, pages 92-100 (2023).",http://dx.doi.org/10.2337/dc21-2305,4,https://scholargps.com/scholars/74105335250496/kyungdo-han,17
Kyungdo Han,The Association of Smoking Status and Clustering of Obesity and Depression on the Risk of Early–Onset Cardiovascular Disease in Young Adults: A Nationwide Cohort Study,http://dx.doi.org/10.4070/kcj.2022.0179,"Kim, Choon-Young | Lee, Cheol Min | Lee, Seungwoo | Yoo, Jung Eun | Lee, Heesun | Park, Hyo Eun | Han, Kyungdo | Choi, Su-Yeon","Korean Circulation Journal, volume 53, issue 1, pages 17- (2023).",http://dx.doi.org/10.4070/kcj.2022.0179,5,https://scholargps.com/scholars/74105335250496/kyungdo-han,17
Kyungdo Han,Diabetes screening in South Korea: a new estimate of the number needed to screen to detect diabetes,http://dx.doi.org/10.3904/kjim.2022.283,"Ha, Kyoung Hwa | Lee, Kyung Ae | Han, Kyung-Do | Moon, Min Kyong | Kim, Dae Jung","The Korean Journal of Internal Medicine, volume 38, issue 1, pages 93-100 (2023).",http://dx.doi.org/10.3904/kjim.2022.283,7,https://scholargps.com/scholars/74105335250496/kyungdo-han,17
Kyungdo Han,Impact of Socioeconomic Status on Emergency Department Visits in Patients With Atrial Fibrillation: A Nationwide Population‐Based Cohort Study,http://dx.doi.org/10.1161/JAHA.122.027192,"Lee, Seo‐Young | Lee, So‐Ryoung | Choi, Eue‐Keun | Han, Kyung‐Do | Oh, Seil | Lip, Gregory Y. H.","Journal of the American Heart Association, volume 11, issue 24 (2022).",http://dx.doi.org/10.1161/JAHA.122.027192,6,https://scholargps.com/scholars/74105335250496/kyungdo-han,17
Kyungdo Han,Association Between Metabolic Syndrome and Risk of Esophageal Cancer: a Nationwide Population-Based Study,http://dx.doi.org/10.1158/1055-9965.EPI-22-0703,"Lee, Ji Eun | Han, Kyungdo | Yoo, Juhwan | Yeo, Yohwan | Cho, In Young | Cho, Belong | Park, Jin-Ho | Shin, Dong Wook | Cho, Jong Ho | Park, Yong-Moon","Cancer Epidemiology, Biomarkers & Prevention, volume 31, issue 12, pages 2228-2236 (2022).",http://dx.doi.org/10.1158/1055-9965.EPI-22-0703,4,https://scholargps.com/scholars/74105335250496/kyungdo-han,17
Kyungdo Han,Hormone therapy and the decreased risk of dementia in women with depression: a population-based cohort study,http://dx.doi.org/10.1186/s13195-022-01026-3,"Kim, Hyewon | Yoo, Juhwan | Han, Kyungdo | Lee, Dong-Yun | Fava, Maurizio | Mischoulon, David | Jeon, Hong Jin","Alzheimer's Research & Therapy, volume 14, issue 1 (2022).",http://dx.doi.org/10.1186/s13195-022-01026-3,13,https://scholargps.com/scholars/74105335250496/kyungdo-han,17
Kyungdo Han,Risk of dementia according to the smoking habit change after ischemic stroke: a nationwide population-based cohort study,http://dx.doi.org/10.1038/s41598-022-27083-0,"Cheon, Dae Young | Han, Kyung do | Oh, Mi Sun | Yu, Kyung-Ho | Lee, Byung-Chul | Kim, Chi-Hun | Kim, Yerim | Lee, Sang-Hwa | Kim, Chulho | Lim, Jae-Sung | Lee, Minwoo","Scientific Reports, volume 12, issue 1 (2022).",http://dx.doi.org/10.1038/s41598-022-27083-0,1,https://scholargps.com/scholars/74105335250496/kyungdo-han,17
Kyungdo Han,Association of duration of undernutrition with occurrence of tuberculosis,http://dx.doi.org/10.1186/s12889-022-14876-1,"Park, Jiho | Yoon, Ji Hyun | Ki, Hyun Kyun | Eun, Yeonghee | Han, Kyungdo | Kim, Hyungjin","BMC Public Health, volume 22, issue 1 (2022).",http://dx.doi.org/10.1186/s12889-022-14876-1,2,https://scholargps.com/scholars/74105335250496/kyungdo-han,17
Kyungdo Han,Cumulative Burden of Being Underweight Increases the Risk of Hip Fracture: A Nationwide Population-Based Cohort Study,http://dx.doi.org/10.3390/healthcare10122568,"Lee, Han-Dong | Han, Sangsoo | Jang, Hae-Dong | Han, Kyungdo | Chung, Nam-Su | Chung, Hee-Woong | Park, Ki-Hoon | Yoon, Ha-Seung | Hong, Jae-Young","Healthcare, volume 10, issue 12, pages 2568- (2022).",http://dx.doi.org/10.3390/healthcare10122568,1,https://scholargps.com/scholars/74105335250496/kyungdo-han,17
Kyungdo Han,Associations between migraine and major cardiovascular events in type 2 diabetes mellitus,http://dx.doi.org/10.1186/s12933-022-01705-3,"Cheon, Dae Young | Han, Kyungdo | Yang, Ye Seul | Kim, Yerim | Lee, Sang-Hwa | Kim, Chulho | Sohn, Jong-Hee | Oh, Mi Sun | Lee, Byung-Chul | Lee, Minwoo | Yu, Kyung-Ho","Cardiovascular Diabetology, volume 21, issue 1 (2022).",http://dx.doi.org/10.1186/s12933-022-01705-3,4,https://scholargps.com/scholars/74105335250496/kyungdo-han,17
Kyungdo Han,Increased risk of cataract surgery in patients with allergic disease: a population based cohort study,http://dx.doi.org/10.1038/s41598-022-25589-1,"Paik, Ji-Sun | Han, Kyungdo | Nam, Gahee | Park, Sun-Kyoung | Hwang, Ho Sik | Chun, Yoon Hong | Na, Kyung-Sun","Scientific Reports, volume 12, issue 1 (2022).",http://dx.doi.org/10.1038/s41598-022-25589-1,1,https://scholargps.com/scholars/74105335250496/kyungdo-han,17
Kyungdo Han,The association of fatty liver index and BARD score with all-cause and cause-specific mortality in patients with type 2 diabetes mellitus: a nationwide population-based study,http://dx.doi.org/10.1186/s12933-022-01691-6,"Chung, Goh Eun | Jeong, Su-Min | Cho, Eun Ju | Yoon, Ji Won | Yoo, Jeong-Ju | Cho, Yuri | Lee, Kyu-na | Shin, Dong Wook | Kim, Yoon Jun | Yoon, Jung-Hwan | ... | Yu, Su Jong","Cardiovascular Diabetology, volume 21, issue 1 (2022).",http://dx.doi.org/10.1186/s12933-022-01691-6,3,https://scholargps.com/scholars/74105335250496/kyungdo-han,17
